{
  "schema_version": 2,
  "engagement_id": "cb-audit-2026-04-10",
  "phase": "closed",
  "targets": [
    "commit-boost-client",
    "https://github.com/Commit-Boost/commit-boost-client",
    "version 0.9.3"
  ],
  "trust_boundaries": [
    {
      "name": "TB-1 Prysm keystore key derivation (loader.rs:load_from_prysm_format)",
      "assumption": "PBKDF2-derived 32-byte key; only lower 16 bytes used for AES-128-CTR. Key is attacker-influenced via password file.",
      "evidence": "decryption_key[..16] used for key, decryption_key[16..] silently discarded — only 128 bits of entropy consumed from a 256-bit derivation."
    },
    {
      "name": "TB-2 ERC2335 proxy delegation load (store.rs:load_proxies)",
      "assumption": "Delegation signature loaded from .sig file on disk, deserialized as BlsSignature — NOT re-validated against the delegator public key during load.",
      "evidence": "trust_level: unverified used as validated. If .sig file is tampered, the proxy signer operates with an invalid delegation."
    },
    {
      "name": "TB-3 JWT decode/validate coupling (utils.rs:decode_jwt / validate_jwt)",
      "assumption": "decode_jwt extracts module_id with signature validation explicitly disabled; validate_jwt then checks the signature. Race or call-order confusion could allow using a decoded-but-unvalidated module_id.",
      "evidence": "Separation of decode and validate is a design-level coupling risk; callers must always call both in correct order."
    },
    {
      "name": "TB-4 Secret key bytes lifetime (schemes/bls.rs, schemes/ecdsa.rs)",
      "assumption": "Raw secret key bytes returned as Vec<u8> / [u8;32] with no zeroize-on-drop, used in ProxyStore::store_proxy_bls/ecdsa for serialization to disk.",
      "evidence": "Key material persists in heap memory after use."
    },
    {
      "name": "TB-5 GENESIS_VALIDATORS_ROOT domain (signature.rs:compute_domain)",
      "assumption": "GENESIS_VALIDATORS_ROOT is hardcoded to [0;32]; intentional for builder domains but must also be correct for COMMIT_BOOST_DOMAIN usage.",
      "evidence": "Domain computed with zero GVR — cross-chain replay possible if domain separation relies solely on fork version."
    },
    {
      "name": "TB-6 Module authorization scope (service.rs:handle_request_signature)",
      "assumption": "No per-module restriction on which consensus pubkeys a module can request signatures for. Any module with a valid JWT can sign with any consensus key.",
      "evidence": "module_id is verified but not checked against the requested pubkey's allowed signers."
    },
    {
      "name": "TB-7 Plaintext proxy store (store.rs:ProxyStore::File)",
      "assumption": "Plaintext proxy store writes raw secret bytes to disk as JSON. Marked 'do not use in prod' but present in codebase.",
      "evidence": "Production guard is documentation only, not enforced in code."
    }
  ],
  "critical_paths": [
    {
      "id": "CP-1",
      "name": "BLS signing pipeline (consensus)",
      "entry": "handle_request_signature -> LocalSigningManager::sign_consensus -> ConsensusSigner::sign -> sign_commit_boost_root -> compute_domain + compute_signing_root -> BlsSecretKey::sign",
      "risk": "HIGH — domain construction and signing root are the last line of defense against cross-protocol replay"
    },
    {
      "id": "CP-2",
      "name": "Proxy delegation creation and validation",
      "entry": "create_proxy_bls/ecdsa -> ProxyDelegation.tree_hash_root -> sign_consensus -> SignedProxyDelegation",
      "risk": "HIGH — delegation binds proxy key to consensus key; if domain or message encoding is wrong, delegations are forgeable"
    },
    {
      "id": "CP-3",
      "name": "ERC-2335 proxy key load path",
      "entry": "ProxyStore::load_proxies (ERC2335) -> load_bls_signer / load_ecdsa_signer -> BlsProxySigner construction WITHOUT re-validating delegation signature",
      "risk": "HIGH — .sig file tampering goes undetected"
    },
    {
      "id": "CP-4",
      "name": "Prysm keystore decryption",
      "entry": "load_from_prysm_format -> pbkdf2 -> AES-128-CTR (lower 16 bytes of 32-byte key) -> JSON parse -> ConsensusSigner",
      "risk": "MEDIUM — key derivation and IV handling need review; only 128 bits used from 256-bit PBKDF2 output"
    },
    {
      "id": "CP-5",
      "name": "JWT authentication flow",
      "entry": "jwt_auth middleware -> decode_jwt (no sig check) -> validate_jwt (sig check) -> module_id inserted into request extensions",
      "risk": "MEDIUM — two-step auth with insecure decode-first is fragile; must verify no code path uses module_id between decode and validate"
    },
    {
      "id": "CP-6",
      "name": "ECDSA proxy signing",
      "entry": "sign_proxy_ecdsa -> EcdsaSigner::sign -> compute_domain(COMMIT_BOOST_DOMAIN) -> sign_hash_sync",
      "risk": "MEDIUM — secp256k1 signing with COMMIT_BOOST_DOMAIN; verify EIP-712 / replay protection"
    }
  ],
  "unresolved_assumptions": [
    "DIM-2: Confirm the AES-128-CTR 32->16 byte key truncation matches the Prysm spec and is not a truncation bug (resolved FALSE POSITIVE in NF-02)."
  ],
  "route_dispositions": [
    {
      "skill": "ecc-pairing-auditor",
      "status": "verified",
      "summary": "BLS/ECDSA signing pipeline, domain construction, and delegation binding reviewed; F-01..F-04 raised.",
      "evidence_refs": [
        "zk-findings/sessions/commit-boost/cb-audit-2026-04-10-report.md"
      ]
    },
    {
      "skill": "encryption-scheme-auditor",
      "status": "verified",
      "summary": "Prysm keystore AES-128-CTR path lacks MAC/checksum verification (F-05) and has an unbounded PBKDF2 iteration parameter (F-06).",
      "evidence_refs": [
        "zk-findings/sessions/commit-boost/cb-audit-2026-04-10-report.md#F-05"
      ]
    },
    {
      "skill": "rust-crypto-safety",
      "status": "verified",
      "summary": "Secret bytes not zeroized after use (F-04); zero-address guard missing in verify_ecdsa_signature (F-07).",
      "evidence_refs": [
        "zk-findings/sessions/commit-boost/cb-audit-2026-04-10-report.md#F-04"
      ]
    },
    {
      "skill": "dependency-auditor",
      "status": "observation",
      "summary": "blstrs_plus is an untagged internal fork of blstrs (DEP-01); no exploitable bug in current usage.",
      "evidence_refs": [
        "zk-findings/sessions/commit-boost/cb-audit-2026-04-10-report.md#DEP-01"
      ]
    },
    {
      "skill": "crypto-fp-check",
      "status": "false_positive",
      "summary": "JWT two-step auth (NF-01) and Prysm AES key truncation (NF-02) dismissed as false positives after verification.",
      "evidence_refs": [
        "zk-findings/sessions/commit-boost/cb-audit-2026-04-10-report.md"
      ]
    }
  ],
  "open_findings": [],
  "verified_findings": [
    {
      "id": "F-01",
      "severity": "Medium",
      "summary": "ERC-2335 proxy delegation not re-validated on load. BlsProxySigner is constructed with a delegation loaded from .sig file without calling validate(); a tampered .sig file installs an invalid delegation silently. (crates/common/src/signer/store.rs:354-369)",
      "report_ref": "zk-findings/sessions/commit-boost/cb-audit-2026-04-10-report.md#F-01"
    },
    {
      "id": "F-02",
      "severity": "High",
      "summary": "Any authenticated module can request consensus key signatures. handle_request_signature dispatches SignRequest::Consensus without checking that the requesting module_id is authorized for the requested pubkey. (crates/signer/src/service.rs:278-281)",
      "report_ref": "zk-findings/sessions/commit-boost/cb-audit-2026-04-10-report.md#F-02"
    },
    {
      "id": "F-03",
      "severity": "Medium",
      "summary": "GVR=0 enables cross-chain replay for custom chain deployments. Named chains safe (distinct fork_versions); two Chain::Custom deployments sharing the same fork_version produce identical COMMIT_BOOST_DOMAINs. (crates/common/src/constants.rs:2, signature.rs:40)",
      "report_ref": "zk-findings/sessions/commit-boost/cb-audit-2026-04-10-report.md#F-03"
    },
    {
      "id": "F-04",
      "severity": "Medium",
      "summary": "BLS and ECDSA secret bytes not zeroized after use. secret() returns raw key bytes with no ZeroizeOnDrop; Bytes/Vec locals in store.rs not zeroized after serialization. (schemes/bls.rs:31-35, schemes/ecdsa.rs:80-83, store.rs:88,103,125,140)",
      "report_ref": "zk-findings/sessions/commit-boost/cb-audit-2026-04-10-report.md#F-04"
    },
    {
      "id": "F-05",
      "severity": "High",
      "summary": "Prysm keystore decryption lacks MAC/checksum verification. PrysmKeystore omits crypto.checksum; AES-128-CTR decryption proceeds without any integrity check, allowing attacker-crafted ciphertext to substitute arbitrary BLS keys. (loader.rs:232-279, types.rs:46-125)",
      "report_ref": "zk-findings/sessions/commit-boost/cb-audit-2026-04-10-report.md#F-05"
    },
    {
      "id": "F-06",
      "severity": "Medium",
      "summary": "Prysm PBKDF2 iteration count attacker-controllable, no minimum enforced. keystore.c read from attacker-controllable JSON with no bounds check; c=1 degrades the KDF, c=u32::MAX causes DoS hang. (loader.rs:254-257)",
      "report_ref": "zk-findings/sessions/commit-boost/cb-audit-2026-04-10-report.md#F-06"
    },
    {
      "id": "F-07",
      "severity": "Low",
      "summary": "verify_ecdsa_signature does not reject zero address (latent). No check that recovered != Address::ZERO; currently only used in tests, latent risk for future callers. (schemes/ecdsa.rs:109-117)",
      "report_ref": "zk-findings/sessions/commit-boost/cb-audit-2026-04-10-report.md#F-07"
    },
    {
      "id": "DEP-01",
      "severity": "Informational",
      "summary": "blstrs_plus is an untagged internal fork of blstrs (Cargo.toml:90 commit c4ea6b21). Divergence from upstream blstrs 0.7.1 unaudited; no exploitable bug found in current usage.",